0;Blade Ward;Abjuration Cantrip;1 action;Self;V, S;1 round; You extend your hand and trace a sigil of warding in the air. Until the end of your next turn, you have resistance against bludgeoning, piercing, and slashing damage dealt by weapon attacks.;Warlock
0;Chill Touch;Necromancy Cantrip;1 action;120 feet;V, S;1 round; You create a ghostly, skeletal hand in the space of a creature within range. Make a ranged spell attack against the creature to assail it with the chill of the grave. On a hit, the target takes 1d8 necrotic damage, and it can't regain hit points until the start of your next turn. Until then, the hand clings to the target. If you hit an undead target, it also has disadvantage on attack rolls against you until the end of your next turn. This spell's damage increases by 1d8 when you reach 5th level (2d8), 11th level (3d8), and 17th level (4d8).;Warlock
0;Eldritch Blast;Evocation Cantrip;1 action;120 feet;V, S;Instantaneous; A beam of crackling energy streaks toward a creature within range. Make a ranged spell attack against the target. On a hit, the target takes 1d10 force damage. The spell creates more than one beam when you reach higher levels: two beams at 5th level, three beams at 11th level, and four beams at 17th level. you can direct the beams at the same target or at different ones. Make a separate attack roll for each beam.;Warlock
0;Friends;Enchantment Cantrip;1 action;Self;S, M ;Concentration, up to 1 minute;(a small amount of makeup applied to the face as this spell is cast) For the duration, you have advantage on all Charisma checks directed at one creature of your choice that isn't hostile toward you. When the spell ends, the creature realizes that you used magic to influence its mood and becomes hostile toward you. A creature prone to violence might attack you. Another creature might seek retribution in other ways (at the DM's discretion), depending on the nature of your interaction with it.;Warlock
0;Mage Hand;Conjuration Cantrip;1 action;30 feet;V, S;1 minute; A spectral, floatin hand appears at a point you choose within range. The hand lasts for the duration or until you dismiss it as an action. The hand vanishes if it is ever more than 30 feet away from you or if you cast this spell again. You can use your action to control the hand. You can use the hand to manipulate an object, open an unlocked foor or container, stow or retrieve an item from an open container, or pour the contents out of a vial. You can move the hand up to 30 feet each time you use it. The hand can't attack, activate magical items, or carry more than 10 pounds.;Warlock
0;Minor Illusion;Illusion Cantrip;1 action;30 feet;S, M ;1 minute;(a bit of fleece) You create a sound or an image of an object within range that lasts for the duration. The illusion also ends if you dismiss it as an action or cast this spell again. If you create a sound, its volume can range from a whisper to a scream. It can be your voice, someone else's voice, a lion's roar, a beating of drums, or any other sound you choose. The sound continues unabated throughout the duration, or you can make discrete sounds at different times before the spell ends. If you create an image of an object?such as a chair, muddy footprints, or a small chest?it must be no larger than a 5-foot cube. The image can't create sound, light, smell, or any other sensory effect. Physical interaction with the image reveals it to be an illusion, because things can pass through it. If a creature uses its action to examine the sound or image, the creature can determine that it is an illusion with a successful Intelligence (Investigation) check against your spell save DC. If a creature discerns the illusion for what it is, the illusion becomes faint to the creature.;Warlock
0;Poison Spray;Conjuration Cantrip;1 action;10 feet;V, S;Instantaneous; You extend your hand toward a creature you can see within range and project a puff of noxious gas from your palm. The creature must succeed on a Constitution saving throw or take 1d12 poison damage. This spell's damage increases by 1d12 when you reach 5th level (2d12), 11th level (3d12), and 17th level (4d12).;Warlock
0;Prestidigitation;Transmutation Cantrip;1 action;10 feet;V, S;Up to 1 hour; This spell is a minor magical trick that novice spellcasters use for practice. You create one of the following magical effects within range:<br>- You create an instantaneous, harmless sensory effect, such as a shower of sparks, a puff of wind, faint musical notes, or an odd odor.<br>- You instantaneously light or snuff out a candle, a torch, or a small campfire.<br>- You instantaneously clean or soil an object no larger than 1 cubic foot.<br>- You chill, warm, or flavor up to 1 cubic foot of nonliving material for 1 hour.<br>- You make a color, a small mark, or a symbol appear on an object or a surface for 1 hour.<br>- You create a nonmagical trinket or an illusory image that can fit in your hand and that lasts until the end of your next turn. If you cast this spell multiple times, you can have up to three of its non-instantaneous effects active at a time, and you can dismiss such an effect as an action.;Warlock
0;True Strike;Divination Cantrip;1 action;30 feet;S;Concentration, up to 1 round; You extend your hand and point a finger at a target in range. Your magic grants you a brief insight into the target's defenses. On your next turn, you gain advantage on your first attack roll against the target, provided that this spell hasn't ended.;Warlock
0;Create Bonfire;Conjuration cantrip;1 action;60 feet;V, S;Concentration, up to 1 minute; You create a bonfire on ground that you can see within range. Until the spells ends, the bonfire fills a 5-foot cube. Any creature in the bonfire’s space when you cast the spell must succeed on a Dexterity saving throw or take 1d8 fire damage. A creature must also make the saving throw when it enters the bonfire’s space for the first time on a turn or ends its turn there. The spell’s damage increases by 1d8 when you reach 5th level (2d8), 11th level (3d8), and 17th level (4d8).;Warlock (TOEE)
0;Frostbite;Evocation cantrip;1 action;60 feet;V, S;Instantaneous; You cause numbing frost to form on one creature that you can see within range. The target must make a Constitution saving throw. On a failed save, the target takes 1d6 cold damage, and it has disadvantage on the next weapon attack roll it makes before the end of its next turn. The spell’s damage increases by 1d6 when you reach 5th level (2d6), 11th level (3d6), and 17th level (4d6).;Warlock (TOEE)
0;Magic Stone;Transmutation cantrip;1 bonus action;Touch;V, S;1 minute; You touch one to three pebbles and imbue them with magic. You or someone else can make a ranged spell attack with one of the pebbles by throwing it or hurling it with a sling. If thrown, it has a range of 60 feet. If someone else attacks with the pebble, that attacker adds your spellcasting ability modifier, not the attacker’s, to the attack roll. On a hit, the target takes bludgeoning damage equal to 1d6 + your spellcasting ability modifier. Hit or miss, the spell then ends on the stone. If you cast this spell again, the spell ends early on any pebbles still affected by it.;Warlock (TOEE)
0;Thunderclap;Evocation cantrip;1 action;Self (5-foot radius);S;Instantaneous; You create a burst of thunderous sound, which can be heard 100 feet away. Each creature other than you within 5 feet of you must make a Constitution saving throw. On a failed save, the creature takes 1d6 thunder damage. The spell’s damage increases by 1d6 when you reach 5th level (2d6), 11th level (3d6), and 17th level (4d6).;Warlock (TOEE)
1;Armor of Agathya;1st level Abjuration;1 action;Self;V, S, M ;1 hour;(a cup of water)    A protective magical force surrounds you, manifesting as a spectral frost that covers you and your gear. You gain 5 temporary hit points for the duration. If a creature hits you with a melee attack while you have these hit points, the creature takes 5 cold damage. At Higher Levels. When you cast this spell using a spell slot of 2nd level or higher, both the temporary hit points and the cold damage increase by 5 for each slot level above 1st. ;Warlock
1;Arms of Hadar;1st level Conjuration;1 action;Self (10-foot radius);V, S;Instantaneous;    You invoke the power of Hadar, the Dark Hunger. Tendrils of dark energy erupt from you and batter all creatures within 10 feet of you. Each creature in that area must m ake a Strength saving throw. On a failed save, a target takes 2d6 necrotic damage and can't take reactions until its next turn. On a successful save, the creature takes half damage, but suffers no other effect. At Higher Levels. When you cast this spell using a spell slot of 2nd level or higher, the damage increases by 1d6 for each slot level above 1st. ;Warlock
1;Charm Person;1st level Enchantment;1 action;30 feet;V, S;1 hour; You attempt to charm a humanoid you can see within range. It must make a Wisdom saving throw, and does so with advantage if you or your companions are fighting it. If it fails the saving throw, it is charmed by you until the spell ends or until you  or your companions do anything harmful to it.The charmed creature regards you as a friendly acquaintance. When the spell ends, the creature knows it was charmed by you. At Higher Levels. When you cast this spell using a spell slot of 2nd level or higher, you can target one additional creature for each slot level above 1st. The creatures must be within 30 feet of each other when you target them.;Warlock
1;Comprehend Languages (Ritual);1st level Divination;1 action;Self;V, S, M ;1 hour;(a pinch of soot and salt) For the duration, you understand the literal meaning of any spoken language that you hear. You also understand any spoken language that you hear. You also understand any written language that you see, but you must be touching the surface of which the words are written. It takes about 1 minute to read one page of text.  This spell doesn't decode secret messages in a text or glyph, such as an arcane sigil, that isn't part of a written language. ;Warlock
1;Expeditious Retreat;1st level Transmutation;1 bonus action;Self;V, S;Concentration, up to 10 minutes; This spell allows you to move at an incredible pace. When you cast this spell, and then as a bonus action on each of your turns until the spell ends, you can take the Dash action.;Warlock
1;Hellish Rebuke;1st level Evocation;1 reaction;60 feet;V, S;Instantaneous; Reaction: you are being damaged by a creature within 60 feet of you that you can see You point your finger, and the creature that damaged you is momentarily surrounded by hellish flames. The creature must make a Dexterity saving throw. It takes 2d10 fire damage on a failed save, or half as much damage on a successful one. At Higher Levels. When you cast this spell using a spell slot of 2nd level or higher, the damage increases by 1d10 for each slot level above 1st.;Warlock
1;Hex;1st level Enchantment;1 bonus action;90 feet;V, S, M ;Concentration, up to 1 hour;(the petrified eye of a newt) You place a curse on a creature that you can see within range. Until the spell ends, you deal an extra 1d6 necrotic damage to the target whenever you hit it with an attack. Also, choose one ability when yo ucast the spell. The target has disadvantage on ability checks made with the chosen ability. If the target drops to 0 hit points before this spel ends, you can use a bonus action on a subsequent turn of yours to curse a new creature. A remove curse cast on the target ends this spell early. At Higher Levels. When you cast this spell using a spell slot of 3rd or 4th level, you can maintain your concentration on the spell for up to 8 hours. When you use a spell slot of 5th level or higher, you can maintain your concentration on the spell for up to 24 hours.;Warlock
1;Illusory Script (Ritual);1st level Illusion;1 minute;Touch;S, M ;10 days;(a lead-based ink worth at least 10 gp, which the spell consumes) You write on parchment, paper, or some other suitable writing material and imbue it with a potent illusion that lasts for the duration. To you and any creatures you designate when you cast the spell, the writing appears normal, written in your hand, and conveys whatever meaning you intended when you wrote the text. To all others, the writing appears as if it were written in an unknown or magical script that is unintelligible. Alternatively, you can cause the writing to appear to be an entirely different message, written in a different hand and language, though the language must be one you know. Should the spell be dispelled, the original script and the illusion both disappear. A creature with truesight can read the hidden message.;Warlock
1;Protection from Evil and Good;1st level Abjuration;1 action;Touch;V, S, M ;Concentration, up to 10 minutes;(holy water or powdered silver and iron, which the spell consumes) Until the spell ends, one willing creature you touch is protected against certain types of creatures: aberrations, celestials, elementals, fey, fiends, and undead. The protection grants several benefits. Creatures of those types have disadvantage on attack rolls against the target. The target also can't be charmed, frightened, or possessed by them. If the target is already charmed, frightened, or possessed by such a creature, the target has advantage on any new saving throw against the relevant effect.;Warlock
1;Unseen Servant (Ritual);1st level Conjuration;1 action;60 feet;V, S, M ;1 hour;(a piece of string and a bit of wood) This spell creates an invisible, mindless, shapeless force that performs simple tasks at your command until the spell ends. The servant springs into existence in an unoccupied space on the ground within range. It has AC 10, 1 hit point, and a Strength of 2, and it can't attack. If it drops to 0 hit points, the spell ends. Once on each of your turns as a bonus action, you can mentally command the servant to move up to 15 feet and inteact with an object. The servant can perform simple tasks that a human servant could do, such as fetching things, cleaning, mending, folding clothes, lighting fires, serving food, and pouring wine. Once yougive the command, the servant performs the task to the best of its ability until it completes the task, then waits for your next command. If you command the servant to perform a task that would move it more than 60 feet away from you, the spell ends.;Warlock
1;Witch Bolt;1st level Evocation;1 action;30 feet;V, S, M ;Concentration, up to 1 minute;(a twig from a tree that has been struck by lightning) A beam of crackling, blue energy lances out toward a creature within range, forming a sustained arc of lightning between you and the target. Make a ranged spell attack against that creature. On a hit, the target takes 1d12 lightning damage, and on each of your turns for the duration, you can use your action to deal 1d12 lightning damage to the target automatically. The spell ends if you use your action to do anything else. The spell also ends if the target is ever outside the spell's range or if it has total cover from you. At Higher Levels. When you cast this spell using a spell slot of 2nd level or higher, the initial damage increases by 1d12 for each slot level above 1st.;Warlock
1;Faerie Fire;1st level Evocation;1 action;60 feet;V;Concentration, up to 1 minute; Each object in a 20-foot cube within range is outlined in blue, green, or violet light (your choice). Any creature in the area when the spell is cast is also outlined in light if it fails a Dexterity saving throw. For the duration, objects and affected creatures shed dim light in a 10-foot radius. Any attack roll against an affected creature or object has advantage if the attacker can see it, and the affected creature or object can't benefit from being invisible.;Warlock (Archfey)
1;Sleep;1st level Enchantment;1 action;90 feet;V, S, M ;1 minute;(a pinch of find sand, rose petals, or a cricket) This spell sends creatures into a magical slumber. Roll 5d8, the total is how many hit points of creatures this spell can affect. Creatures within 20 feet ofa point you choose within range are affected in ascending order of their current hit points (ignoring unconscious creatures). Starting with the creature that has the lowest current hit points, each creature affected by this spell falls unconscious until the spell ends, the sleeper takes damage, or someone uses an action to shake or slap the sleeper awake. Subtract each creature's hit points from the total before moving on to the creature with the next lowest hit points. A creature's hit points must be equal to or less than the remaining total for that creature to be affected. Undead and creatures immune to being charmed aren't affected by this spell. At Higher Levels. When you cast this spell using a spell slot of 2nd level or higher, roll an additional 2d8 for each slot level above 1st.;Warlock (Archfey)
1;Burning Hands;1st level Evocation;1 action;Self (15-foot cone);V, S;Instantaneous; As you hold your hands with thumbs touching and fingers spread, a thin sheet of flames shoots forth from your outstretched fingertips. Each creature in a 15-foot cone must make a Dexterity saving throw. A creature takes 3d6 fire damage on a failed save, or half as much damage on a successful one. The fire ignites any flammable objects in the area that aren't being worn or carried. At Higher Levels. When you cast this spell using a spell slot of 2nd level or higher, the damage increases by 1d6 for each slot level above 1st.  ;Warlock (Fiend)
1;Command;1st level Enchantment;1 action;60 feet;V;1 round; You speak a one-word command to a creature you can see within range. The target must succeed on a Wisdom saving throw or follow the command on its next turn. The spell has no effect if the target is undead, if it doesn't understand your language, or if your command is directly harmful to it.  Some typical commands and their effects follow. You might issue a command other than one described here. If you do so, the DM determines how the target behaves. If the target can't follow your command, the spell ends.  Approach. The target moves toward you by the shortest and most direct route, ending its turn if it moves within 5 feet of you.  Drop. The target drops whatever it is holding and then ends its turn.  Flee. The target spends its turn moving away from you by the fastest available means.  Grovel. The target falls prone and then ends its turn.  Halt. The target doesn't move and takes no actions. A flying creature stays aloft, provided that it is able to do so. If it must move to stay aloft, it flies the minimum distance needed to remain in the air.  At Higher Levels. When you cast this spell using a spell slot of 2nd level or higher, you can affect one additional creature for each slot level above 1st. The creatures must be within 30 feet of each other when you target them.;Warlock (Fiend)
1;Dissonant Whispers;1st level Enchantment;1 action;60 feet;V;Instantaneous; You whisper a discordant melody that only one creature of your choice within range can hear, wracking it with terrible pain. The target must make a Wisdom saving throw. On a failed save, it takes 3d6 psychic damage and must immediately use its reaction , if available, to move as far as its speed allows away from you. The creature doesn't move into obviously dangerous ground, such as a fire or a pit. On a successful save, the target takes half as much damage and doesn't have to move away. A deafened creature automatically succeeds on the save. At Higher Levels. When you cast this spell using a spell slot of 2nd level or higher, the damage increases by 1d6 for each slot level above 1st.;Warlock (Great Old One)
1;Tasha's Hideous Laugher;1st level enchantment;1 action;30 feet;V, S, M;Concentration, up to 1min;(tiny tarts and a feather that waved in the air) A creature of your choise that can see within range perceives everything as hilariously funne and falls into fits of laugher if this spell affects it. The target must succeed on a Wisdom saving throw of fall prone, becoming incapacitated and unable to stabd up for the duration. A creature with an Intelligence score of 4 or less isn't affected.<br>At the end of each of its turns, and each time it takes damage, the target can make another Wisdom saving throw. The target has advantage on the saving throw if it's triggered by damage. On a success, the spell ends.;Warlock (Great Old One)
2;Cloud of Daggers;2nd level Conjuration;1 action;60 feet;V, S, M ;Concentration, up to 1 minute;(a sliver of glass) You fill the air with spinning daggers in a cube 5 feet on each side, centered on a point you choose within range. A creature takes 4d4 slashing damage when it enters the spell's area for the first time on a turn or starts its turn there. At Higher Levels. when you cast this spell using a spell slot of 3rd level or higher, the damage increases by 2d4 for each slot level above 2nd.;Warlock
2;Crown of Madness;2nd level Enchantment;1 action;120 feet;V, S;Concentration, up to 1 minute; One humanoid of your choice that you can see within range must succeed on a W isdom saving throw or become charmed by you for the duration. While the target is charmed in this way, a twisted crown of jagged iron appears on its head, and a madness glows in its eyes. The charmed target must use its action before moving on each of its turns to make a melee attack against a creature other than itself that you mentally choose. The target can act normally on its turn if you choose no creature or if none are within its reach. On your subsequent turns, you must use your action to maintain control over the target, or the spell ends. Also, the target can make a Wisdom saving throw at the end of each of its turns. On a success, the spell ends.;Warlock
2;Darkness;2nd level Evocation;1 action;60 feet;V, M ;Concentration, up to 10 minutes;(bat fur and a drop of pitch or piece of coal) Magical darkness spreads from a point you choose within range to fill a 15-foot radius sphere for the duration. The darkness spreads around corners. A creature with darkvision can't see through this darkness, and nonmagical light can't illuminate it. If the point you choose is on an object you are holding or one that isn't being worn or carried, the darkness emanates from the object and moves with it. Completely covering the source of the darkness with an opaque object, such as a bowl or a helm, blocks the darkness. If any of this spell's area overlaps with an area of light created by a spell of 2nd level or lower, the spell that created the light is dispelled.;Warlock
2;Enthrall;2nd level Enchantment;1 action;60 feet;V, S;1 minute; You weave a distracting string of words, causing creatures of your choice that you can see within range and that can hear you to make a Wisdom saving throw. Any creature that can't be charmed succeeds on this saving throw automatically, and if you or your companions are fighting a creature, it has advantage on the save. On a failed save, the target has disadvantage on Wisdom (Perception) checks made to perceive any creature other than you until the spell ends or until the target can no longer hear you. The spell ends if you are incapacitated or can no longer speak.;Warlock
2;Hold Person;2nd level Enchantment;1 action;60 feet;V, S, M ;Concentration, up to 1 minute;(a small, straight piece of iron) Choose a humanoid that you can see within range. The target must succeed on a Wisdom saving throw or be paralyzed for the duration. At the end of each of its turns, the target can make another Wisdom saving throw. On a success, the spell ends on the target. At Higher Levels. When you cast this spell using a spell slot of 3rd level or higher, you can target on additional humanoid for each slot level above 2nd. The humanoids must be within 30 feet of each other when you target them.;Warlock
2;Invisibility;2nd level Illusion;1 action;Touch;V, S, M ;Concentration, up to 1 hour;(an eyelash encased in gum arabic) A creature you touch becomes invisible until the spell ends. Anything the target is wearing or carrying is invisible as long as it is on the target's person. The spell ends for a target that attacks or casts a spell. At Higher Levels. When you cast this spell using a spell slot of 3rd level or higher, you can target one additional creature for each slot level above 2nd.;Warlock
2;Mirror Image;2nd level Illusion;1 action;Self;V, S;1 minute; Three illusory duplicates of yourself appear in your space. Until the spell ends, the duplicates move with you and mimic your actions, shifting position so it's impossible to track which image is real. You can use your action to dismiss the illusory duplicates. Each time a creature targets you with an attack during the spell's duration, roll a d20 to determine whether the attack instead targets one of your duplicates. If you have three duplicates, you must roll a 6 or higher to change the attack's target to a duplicate. With two duplicates, you must roll an 8 or higher. With one duplicate, you must roll an 11 or higher. A duplicate's AC equals 10 + your Dexterity modifier. If an attack hits a duplicate, the duplicate is destroyed. A duplicate can be destroyed only by an attack that hits it. It ignores all other damage and effects. The spell ends when all three duplicates are destroyed. A creature is unaffected by this spell if it can't see, if it relies on senses other than sight, such as blindsight, or if it can perceive illusions as false, as with truesight.;Warlock
2;Misty Step;2nd level Conjuration;1 bonus action;Self;V;Instantaneous; Briefly surrounded by silvery mist, you teleport up to 30 feet to an unoccupied space that you can see.;Warlock
