2;Ray of Enfeeblement;2nd level Necromancy;1 action;60 feet;V, S;Concentration, up to 1 minute; A black beam of enervating energy springs from your finger toward a creature within range. Make a ranged spell attack against the target. On a hit, the target deals only half damage with weapon attacks that use Strength until the spell ends. At the end of each of the target's turns, it can make a Constitution saving throw against the spell. On a success, the spell ends. ;Warlock
2;Shatter;2nd level Evocation;1 action;60 feet;V, S, M ;Instantaneous;(a chip of mica) A sudden loud ringing noise, painfully intense, erupts from a point of your choice within range. Each creature in a 10-foot-radius sphere centered on that point must make a Constitution saving throw. A creature takes 3d8 thunder damage on a failed save, or half as much damage on a successful one. A creature made of inorganic material such as stone, crystal, or metal has disadvantage on this saving throw. A nonmagical object that isn't being worn or carried also takes the damage if it's in the spell's area. At Higher Levels. When you cast this spell using a spell slot of 3rd level or higher, the damage increases by 1d8 for each slot level above 2nd.;Warlock
2;Spider Climb;2nd level Transmutation;1 action;Touch;V, S, M ;Concentration, up to 1 hour;(a drop of bitumen and a spider) Until the spell ends, one willing creature you touch gains the ability to move up, down, and across vertical surfaces and upside down along ceilings, while leaving its hands free. The target also gains a climbing speed equal to its walking speed.;Warlock
2;Suggestion;2nd level Enchantment;1 action;30 feet;V, M ;Concentration, up to 8 hours;(a snake's tougne and either a bit of honeycomb or a drop of sweet oil) You suggest a course of activity (limited to a sentence or two) and magically influence a creature you can see within range that can hear and understand you. Creatures that can't be charmed are immune to this effect. The suggestion must be worded in such a manner as to make the course of action sound reasonable. Asking the creature to stab itself, throw itself onto a spear, immolate itself, or do some other obviously harmful act ends the spell. The target must make a Wisdom saving throw. On a failed save, it purses the course of action you described to the best of its ability. The suggested course of action can continue for the entire duration. If the suggested activity can be completed in a shorter time, the spell ends when the subject finishes what it was asked to do. You can also specify conditions that will trigger a special activity during the duration. For example, you might suggest that a knight five her warhorse to the first beggar she meets. If the condition isn't met before the spell expires, the activity isn't preformed. If you or any of your companions damage the target, the spell ends. ;Warlock
2;Calm Emotions;2nd level Enchantment;1 action;60 feet;V, S;Concentration, up to 1 minute; You attempt to suppress strong emotions in a group of people. Each humanoid in a 20-foot-radius sphere centered on a point you choose within range must make a Charisma saving throw,  a creature can choose to fail this saving throw if it wishes. If a creature fails its saving throw, choose one of the following two effects. You can suppress any effect causing a target to be charmed or frightened. When this spell ends, any suppressed effect resumes, provided that its duration has not expired in the meantime. Alternatively, you can make a target indifferent about creatures of your choice that it is hostile toward. This indifference ends if the target is attacked or harmed by a spell or if it witnesses any of its friends being harmed. When the spell ends, the creature becomes hostile again, unless the DM rules otherwise.;Warlock (Archfey)
2;Phantasmal Force;2nd level Illusion;1 action;60 feet;V, S, M ;Concentration, up to 1 minute;(a bit of fleece) You craft an illusion that takes root in the mind of a creature that you can see within range. The target must make an Intelligence saving throw. On a failed save, you create a phantasmal object, creature, or other visible phenomenon of your choice that is no larger than a 10-foot cube and that is perceivable only to the target for the duration. This spell has no effect on undead or constructs. The phantasm includes sound, temperature, and other stimuli, also evident only to the creature. The target can use its action to examine the phantasm with an Intelligence (Investigation) check against your spell save DC. If the check succeeds, the target realizes that the phantasm is an illusion, and the spell ends. While a target is affected by the spell, the target treats the phantasm as if it were real. The target rationalizes any illogical outcomes from interacting with the phantasm. For example, a target attempting to walk across a phantasmal bridge that spans a chasm falls once it steps onto the bridge. If the target survives the fall, it still believes that the bridge exists and comes up with some other explanation for its fall?it w as pushed, it slipped, or a strong wind might have knocked it off. An affected target is so convinced of the phantasm's reality that it can even take damage from the illusion. A phantasm created to appear as a creature can attack the target. Similarly, a phantasm created to appear as fire, a pool of acid, or lava can burn the target. Each round on your turn, the phantasm can deal 1d6 psychic damage to the target if it is in the phantasm's area or within 5 feet of the phantasm, provided that the illusion is of a creature or hazard that could logically deal damage, such as by attacking. The target perceives the damage as a type appropriate to the illusion.;Warlock (Archfey)
2;Blindness/Deafness;2nd level Necromancy;1 action;30 feet;V;1 minute; You can blind or deafen a foe. Choose one creature that you can see within range to make a Constitution saving throw. If it fails, the target is either blinded or deafened (your choice) for the duration. At the end of each of its turns, the target can make a Constitution saving throw. On a success, the spell ends. At Higher Levels. When you cast this spell using a spell slot of 3rd or higher, you can taget one additiona creature for each slot level above 2nd.;Warlock (Fiend)
2;Scorching Ray;2nd level Evocation;1 action;120 feet;V, S;Instantaneous; You create three rays of fire and hurl them at targets within range. You can hurl them at one target or several. Make a ranged spell attack for each ray. On a hit, the target takes 2d6 fire damage. At Higher Levels. When you cast this spell using a spell slot of 3rd level or higher, you create one additional ray for each slot level above 2nd.;Warlock (Fiend)
2;Detect Thoughts;2nd level Divination;1 action;Self;V, S, M ;Concentration, up to 1 minute;(a copper piece) For the duration, you can read the thoughts of certain creatures. When you cast the spell and as your action on each turn until the spell ends, you can focus your mind on any one creature that you can see within 30 feet of you. If the creature you choose has an Intelligence of 3 or lower or doesn't speak any language, the creature is unaffected. You initially learn the surface thoughts of the creature - what is most on its mind in that moment. As an action, you can either shift your attention to another creature's thoughts or attempt to probe deeper into the same creature's mind. If you probe deeper, the target must make a Wisdom saving throw. If it fails, you gain insight into its reasoning (if any), its emotional state, and something that looms large in its mind (such as something it worries over, loves, or hates). If it succeeds, the spell ends. Either way, the target knows that you are probing into its mind, and unless you shift your attention to another creatures thoughts, the creature can use its action on its turn to make an Intelligence check contested by your Intelligence check,  if it succeeds, the spell ends. Questions verbally directed at the target creature naturally shape the course of its thoughts, so this spell is particularly effective as part of an interrogation. You can also use this spell to detect the presence of thinking creatures you can't see. When you cast the spell or as your action during the duration, you can search for thoughts within 30 feet of you. The spell can penetrate barriers, but 2 feet of rock, 2 inches of any metal other than lead, or a thin sheet of lead blocks you. You can't detect a creature with an Intelligence of 3 or lower or one that doesn't speak any language. Once you detect the presence of a creature in this way, you can read its thoughts for the rest of the duration as described above, even if you can't see it, but it must still be within range.;Warlock (Great Old One)
2;Phantasmal Force;2nd level Illusion;1 action;60 feet;V, S, M ;Concentration, up to 1 minute;(a bit of fleece) You craft an illusion that takes root in the mind of a creature that you can see within range. The target must make an Intelligence saving throw. On a failed save, you create a phantasmal object, creature, or other visible phenomenon of your choice that is no larger than a 10-foot cube and that is perceivable only to the target for the duration. This spell has no effect on undead or constructs. The phantasm includes sound, temperature, and other stimuli, also evident only to the creature. The target can use its action to examine the phantasm with an Intelligence (Investigation) check against your spell save DC. If the check succeeds, the target realizes that the phantasm is an illusion, and the spell ends. While a target is affected by the spell, the target treats the phantasm as if it were real. The target rationalizes any illogical outcomes from interacting with the phantasm. For example, a target attempting to walk across a phantasmal bridge that spans a chasm falls once it steps onto the bridge. If the target survives the fall, it still believes that the bridge exists and comes up with some other explanation for its fall?it w as pushed, it slipped, or a strong wind might have knocked it off. An affected target is so convinced of the phantasm's reality that it can even take damage from the illusion. A phantasm created to appear as a creature can attack the target. Similarly, a phantasm created to appear as fire, a pool of acid, or lava can burn the target. Each round on your turn, the phantasm can deal 1d6 psychic damage to the target if it is in the phantasm's area or within 5 feet of the phantasm, provided that the illusion is of a creature or hazard that could logically deal damage, such as by attacking. The target perceives the damage as a type appropriate to the illusion.;Warlock (Great Old One)
2;Earthbind;2nd-level transmutation;1 action;300 feet;V;Concentration, up to 1 minute; Choose one creature you can see within range. Yellow strips of magical energy loop around the creature. The target must succeed on a Strength saving throw or its flying speed (if any) is reduced to 0 feet for the spell’s duration. An airborne creature affected by this spell descends at 60 feet per round until it reaches the ground or the spell ends.;Warlock (TOEE)
3;Counterspell;3rd level Abjuration;1 reaction;60 feet;S;Instantaneous; Reaction: When you see a creature within 60 feet of you casting a spell You attempt to interrupt a creature in the process of casting a spell. If the creature is casting a spell of 3rd level or lower, its spell fails and has no effect. If it is casting a spell of 4th level or higher, make an ability check using your spellcasting ability.  The DC equals 10+ the spell's level. On a success, the creature's spell fails and has no effect. At Higher Level. When you cast this spell using a spell slot of 4th leve lor higher, the interrupted spell has no effect if its level is less than or equal to the leve lof the spell slot you used.;Warlock
3;Dispel Magic;3rd level Abjuration;1 action;120 feet;V, S;Instantaneous; Choose any creature, object, or magical effect within range. Any spell of 3rd level or lower on the target ends. For each spell of 4th level or higher on the target, make an ability check using your spellcasting ability. The DC equals 10 + the spell's level. On a successful check, the spell ends. At Higher Levels. When you cast this spell using a spell slot of 4th level or higher, you automatically end the effects of a spell on the target if the spell's level is equal to or less than the level of the spell slot you used.;Warlock
3;Fear;3rd level Illusion;1 action;Self (30-foot cone);V, S, M ;Concentration, up to 1 minute;(a white feather or the heart of a hen) You project a phantasmal image of a creature's worst fears. Each creature in a 30-foot cone must succeed on a Wisdom saving throw or drop whatever it is holding and become frightened for the duration. While frightened by this spell, a creature must take the Dash action and move away from you by the safest available route on each of its turns, unless there is nowhere to move. If the creature ends its turn in a location where it doesn't have line of sight to you, the creature can make a Wisdom saving throw. On a successful save, the spell ends for that creature.;Warlock
3;Fly;3rd level Transmutation;1 action;Touch;V, S, M ;Concentration, up to 10 minutes;(a wing feather from any bird) You touch a willing creature. The target gains a flying speed of 60 feet for the duration. When the spell ends, the target falls if it is still aloft, unless it can stop the fall. At Higher Levels. When you cast this spell using a spell slot of 4th level or higher, you can target one additional creature for each slot level above 3rd.;Warlock
3;Gaseous Form;3rd level Transmutation;1 action;Touch;V, S, M ;Concentration, up to 1 hour;(a bit of gauze and a wisp of smoke) You transform a willing creature you touch, along with everything it's wearing and carrying, into a misty cloud for the duration. The spell ends if the creature drops to 0 hit points. An incorporeal creature isn't affected. While in this form, the target's only method of movement is a flying speed of 10 feet. The target can enter and occupy the space of another creature. The target has resistance to nonmagical damage, and it has advantage on Strength, Dexterity, and Constitution saving throws. The target can pass through small holes, narrow openeings, and even mere cracks, though it treats liquids as though they were solid surfaces. The target can't fall and remains hovering in the air even when stunned or otherwise incapacitated. While in the form of a misty cloud, the target can't talk or manipulate objects, and any objects it was carrying or holding can't be dropped, used, or otherwise interacted with. The target can't attack or cast spells.;Warlock
3;Hunger of Hadar;3rd level Conjuration;1 action;150 feet;V, S, M ;Concentration, up to 1 minute;(a pickled octopus tentacle) You open a gateway to the dark between the stars, a region infested with unknown horrors. A 20-foot-radius sphere of blackness and bitter cold appears, centered on a point with range and lasting for the duration. This void is filled with a cacophony of soft whispers and slurping noises that can be heard up to 30 feet away. No light, magical or otherwise, can illuminate the area, and creatures uflly within the area are blinded. The void creates a warp in the fabric of space, and the area is difficult terrain. Any creature that starts its turn in the area takes 2d6 cold damage. Any creature that ends its turn in the area must succeed on a Dexterity saving throw or take 2d6 acid damage as milky, otherwordly tentacles rub against it.;Warlock
3;Hypnotic Pattern;3rd level Illusion;1 action;120 feet;S, M ;Concentration, up to 1 minute;(a glowing stick o f incense or a crystal vial filled with phosphorescent material) You create a twisting pattern of colors that weaves through the air inside a 30-foot cube within range. The pattern appears for a moment and vanishes. Each creature in the area who sees the pattern must make a Wisdom saving throw. On a failed save, the creature becomes charmed for the duration. While charmed by this spell, the creature is incapacitated and has a speed of 0. The spell ends for an affected creature if it takes any damage or if someone else uses an action to shake the creature out of its stupor.;Warlock
3;Magic Circle;3rd level Abjuration;1 minute;10 feet;V, S, M ;1 hour;(holy water or powdered silver and iron worth at least 100 gp, which the spell consumes) You create a 10-foot-radius, 20-foot-tall cylinder of magical energy centered on a point on the ground that you can see within range. Glowing runes appear wherever the cylinder intersects with the floor or other surface. Choose one or more of the following types of creatures: celestials, elementals, fey, fiends, or undead. The circle affects a creature of the chosen type in the following ways: * The creature can't willingly enter the cylinder by nonmagical means. If the creature tries to use teleportation or interplanar travel to do so, it must first succeed on a Charisma saving throw. * The creature has disadvantage on attack rolls against targets within the cylinder. * Targets within the cylinder can't be charmed, frightened, or possessed by the creature. When you cast this spell, you can elect to cause its magic to operate in the reverse direction, preventing a creature of the specified type from leaving the cylinder and protecting targets outside it. At Higher Levels. When you cast this spell using a spell slot of 4th level or higher, the duration increases by 1 hour for each slot level above 3rd.;Warlock
3;Major Image;3rd level Illusion;1 action;120 feet;V, S, M ;Concentration, up to 10 minutes;(a bit of fleece) You create the image of an object, a creature, or some other visible phenomenon that is no larger than a 20-foot cube. The image appears at a spot that you can see within range and lasts for the duration. It seems completely real, including sounds, smells, and temperature appropriate to the thing depicted. You can't create sufficient heat or cold to cause damage, a sound loud enough to deal thunder damage or deafen a creature, or a smell that might sicken a creature (like a troglodyte's stench). As long as you are within range of the illusion, you can use your action to cause the image to move to any other spot within range. As the image changes location, you can alter its appearance so that its movements appear natural for the image. For example, if you create an image of a creature and move it, you can alter the image so that it appears to be walking. Similarly, you can cause the illusion to make different sounds at different times, even making it carry on a conversation, for example. Physical interaction with the image reveals it to be an illusion, because things can pass through it. A creature that uses its action to examine the image can determine that it is an illusion with a successful Intelligence (Investigation) check against your spell save DC. If a creature discerns the illusion for what it is, the creature can see through the image, and its other sensory qualities become faint to the creature. At Higher Levels. When you cast this spell using a spell slot of 6th level or higher, the spell lasts until dispelled, without requiring your concentration. ;Warlock
3;Remove Curse;3rd level Abjuration;1 action;Touch;V, S;Instantaneous; At your touch, all curses affecting one creature or object end. If the object is a cursed magic item, its curse remains, but the spell breaks its owner's attunement to the object so it can be removed or discarded. ;Warlock
3;Tongues;3rd level Divination;1 action;Touch;V, M ;1 hour;(a small clay model of a ziggurat) This spell grants the creature you touch the ability to understand any spoken language it hears. Moreover, when the target speaks, any creature that knows at least one language and can hear the target understands what it says. ;Warlock
3;Vampiric Touch;3rd level Necromancy;1 action;Self;V, S;Concentration, up to 1 minute;   The touch of your shadow-wreathed hand can siphon force from others to heal your wounds. Make a melee spell attack against a creature within your reach. On a hit, the target takes 3d6 necrotic damage, and you regain hit points equal to half the amount of necrotic damage dealt. Until the spell ends, you can make the attack again on each of your turns as an action.   At Higher Levels. When you cast this spell using a spell slot of 4th level or higher, the damage increases by 1d6 for each slot level above 3rd.;Warlock
3;Blink;3rd level Transmutation;1 action;Self;V, S;1 minute; Roll a d20 at the end of each of your turns for the duration of the spell. On a roll of 11 or higher, you vanish from your current plane of existence and appear in the Etheral Plane (the spell fails and the casting is wasted if you were already on that plane). At the start of you next turn, and when the spell ends if you are on the Etheral Plane, you return to an unoccupied space of your choice that you can see within 10 feet of the space you vanished from. If no unoccupied space is available within that rang, you appear in the nearest unoccupied space (chosen at random if more that one space is equally near). You can dismiss this spell as an action. While on the Ethereal Plane, you can see and hear the plane you originated from, which is cast in shades of gray, and you can't see anything more than 60 feet away.You can only affect and be affected by other reatures on the Ethereal Plane. Creature that aren't there can't perceive you or interact with you, unless they have the ability to do so.;Warlock (Archfey)
3;Plant Growth;3rd level Transmutation;1 action or 8 hours;150 feet;V, S;Instantaneous; This spell channels vitality into plants within a specific area. There are two possible uses for the spell, granting either immediate or long-term benefits. If you cast this spell using 1 action, choose a point within range. All normal plants in a 100-foot radius centered on that point become thick and overgrown. A creature moving through the area must spend 4 feet of movement for every 1 foot it moves. You can exclude one or more areas of any size within the spell's area from being affected. If you cast this spell over 8 hours, you enrich the land. All plants in a half-mile radius centered on a point within range become enriched for 1 year. The plants yield twice the normal amount of food when harvested.;Warlock (Archfey)
3;Fireball;3rd level Evocation;1 action;150 feet;V, S, M ;Instantaneous;(a tiny ball of bat guana and sulfur) A bright streak flashes from your pointing finger to a point you choose within range then blossoms with a low roar into an explosion of flame. Each creature in a 20-foot radius must make a Dexterity saving throw. A target takes 8d6 fire damage on a failed save, or half as much damage on a successful one. The fire spreads around corners. It ignites flammable objects in the area that aren't being worn or carried. At Higher Levels. When you cast this spell using a spell slot of 4th level of higher, the damage increases by 1d6 for each slot level above 3rd.;Warlock (Fiend)
3;Stinking Cloud;3rd level Conjuration;1 action;90 feet;V, S, M ;Concentration, up to 1 minute;(a rotten egg or several skunk cabbage leaves) You create a 20-foot-radius sphere of yellow, nauseating gas centered on a point within range. The cloud spreads around corners, and its area is heavily obscured. The cloud lingers in the air for the duration. Each creature that is completely within the cloud at the start of its turn must make a Constitution saving throw against poison. On a failed save, the creature spends its action that turn retching and reeling. Creatures taht don't need to breathe or are immune to poison automatically succeed on this saving throw. A moderate wind (at least 10 miles per hour) disperses the cloud after 4 rounds. A strong wind (at least 20 miles per hour) disperses it after 1 round.;Warlock (Fiend)
3;Clairvoyance;3rd level Divination;10 minutes;1 mile;V, S, M ;Concentration, up to 10 minutes;(a focus worth at least 100 gp, either a jeweled horn for hearing or a glass eye for scrying) You create an invisible sensor within range in a location familiar to you (a place you have visited or seen before) or in an obvious location that is unfamiliar to you (such as behind a door, around a corner, or in a grove of trees). The sensor remains in place for the duration, and it can't be attacked or otherwise interacted with. When you cast the spell, you choose seeing or hearing. You can use the chosen sense through the sensor as if you were in its space. As your action, you can switch between seeing and hearing. A creature that can see the sensor (such as a creature benefitting from see invisibility or truesight) sees a luminous, intangible orb about the size of your fist.;Warlock (Great Old One)
3;Sending;3rd level Evocation;1 action;Unlimited;V, S, M ;1 round;(A short piece of fine copper wire) You send a short message of twenty-five words or less to a creature with you are familiar. The creature hears the message in its mind, regonizes you as the sender if it knows you, and can answer in a like manner immediately. The spell enables creatures with Intelligence scores of at least 1 to understand the meaning of your message. You can send the message across any distance and even to other planes of existence, but if the target is on a different plane than you, there is a 5 percent chance that the message doesn't arrive.;Warlock (Great Old One)
