4;Banishment;4th level Abjuration;1 action;60 feet;V, S, M ;Concentration, up to 1 minute;(an item distasteful to the target) You attempt to send one creature that you can see within range to another place of existence. The target must succeed on a Charisma saving throw or be banished. If the target is native to the plane of existence you're on, you banish the target to a harmless demiplane. While there, the target is incapacitated. The target remains there until the spell ends, at which point the target reappears in the space it left or in the nearest unoccupied space if that space is occupied. If the taret is native to a different plane of existence that the one you're on, the target is banished with a faint popping noise, returning to its home plane. If the spell ends before 1 minute has passed, the target reappears in the space it left or in the nearest unoccupied space if that space is occupied. Otherwise, the target doesn't return. At Higher Levels. When you cast this spell using a spell slot of 5th level or higher, you can target one additional creature for each slot level above 4th.;Warlock
4;Blight;4th level Necromancy;1 action;30 feet;V, S;Instantaneous; Necromantic energy washes over a creature of your choice that you can see within range, draining moisture and vitality from it. The target must make a Constitution saving throw. The target takes 8d8 necrotic damage on a failed save, or half as much damagfe on a successful one. This spell has no effect on undead or constructs. If you target a plant creature or a magical plant, it makes the saving throw with disadvantage, and the spell deals maximum damage to it. If you target a nonmagical plant that isn't a creature, such as a tree or shrub, it doesn't make a saving throw,  it simply withers and dies. At Higer Levels. When you cast this spell using a spell slot of 5th level or higher, the damage increases by 1d8 for each slot level above 4th.;Warlock
4;Dimension Door;4th level Conjuration;1 action;500 feet;V;Instantaneous; You teleport yourself from your current location to any other spot within range. You arrive at exactly the spot desired. It can be a place you can see, one you can visualize, or one you can describe by stating distance and direction, such as ⫿200 feet straight downward? or ⫿upward to the northwest at a 45-degree angle, 300 feet.? You can bring along objects as long as their weight doesn't exceed what you can carry. You can also bring one willing creature of your size or smaller who is carrying gear up to its carrying capacity. The creature must be within 5 feet of you when you cast this spell. If you would arrive in a place already occupied by an object or a creature, you and any creature traveling with you each take 4d6 force damage, and the spell fails to teleport you.;Warlock
4;Hallucinatory Terrain;4th level Illusion;10 minutes;300 feet;V, S, M ;24 hours;(a stone, a twig, and a bit of green plant) You make natural terrain in a 150-foot cube in range look, sound, and smell like some other sort of natural terrain. Thus, open fields or a road can be made to resemble a swamp, hill, crevasse, or some other difficult or impassable terrain. A pond can be made to seem like a grassy meadow, a precipice like a gentle slope, or a rock-strewn gully like a wide and smooth road. Manufactured structures, equipment, and creatures within the area aren't changed in appearance. The tactile characteristics of the terrain are unchanged, so creatures entering the area are likely to see through the illusion. If the difference isn't obvious by touch, a creature carefully examining the illusion can attempt an Intelligence (Investigation) check against your spell save DC to disbelieve it. A creature who discerns the illusion for what it is, sees it as a vague image superimposed on the terrain.;Warlock
4;Dominate Beast;4th level Enchantment;1 action;60 feet;V, S;Concentration, up to 1 minute; You attempt to beguile a beast that you can see within range. It must succeed on a W isdom saving throw or be charmed by you for the duration. If you or creatures that are friendly to you are fighting it, it has advantage on the saving throw. While the beast is charmed, you have a telepathic link with it as long as the two of you are on the same plane of existence. You can use this telepathic link to issue commands to the creature while you are conscious (no action required), which it does its best to obey. You can specify a simple and general course of action, such as ⫿Attack that creature,? ⫿Run over there,? or ⫿Fetch that object.? If the creature completes the order and doesn't receive further direction from you, it defends and preserves itself to the best of its ability. You can use your action to take total and precise control of the target. Until the end of your next turn, the creature takes only the actions you choose, and doesn't do anything that you don't allow it to do. During this time, you can also cause the creature to use a reaction, but this requires you to use your own reaction as well. Each time the target takes damage, it makes a new Wisdom saving throw against the spell. If the saving throw succeeds, the spell ends. At Higher Levels. W hen you cast this spell with a 5th-level spell slot, the duration is concentration, up to 10 minutes. When you use a 6th-level spell slot, the duration is concentration, up to  1 hour. When you use a spell slot of 7th level or higher, the duration is concentration, up to 8 hours.;Warlock (Archfey)
4;Greater Invisibility;4th level Illusion;1 action;Touch;V, S;Concentration, up to 1 minute; You or a creature you touch becomes invisible until the spell ends. Anything the target is wearing or carrying is invisible as long as it is on the target's person.;Warlock (Archfey)
4;Fire Shield;4th level Evocation;1 action;Self;V, S, M ;10 minutes;(a bit of phosphorous or a firefly) Thin and wispy flames wreathe your body for the duration, shedding bright light in a 10-foot radius and dim light for an additional 10 feet, You can end the spell early by using an action to dismiss it. The flames provide you with a warm shield or a chill shield, as you choose. The warm shield grants you resistance to cold damage, and the chill shield grants you resistance to fire damage. In addition, whenever a creature within 5 feet of you hits you with a melee attack, the shield erupts with flame. The attacker takes 2d8 fire damage from a warm shield, or 2d8 cold damage from a cold shield.;Warlock (Fiend)
4;Wall of Fire;4th level Evocation;1 action;120 feet;V, S, M ;Concentration, up to 1 minute;(a small piece of phosphorus) You create a wall of fire on a solid surface within range. You can make the wall up to 60 feet long, 20 feet high, and 1 foot think, or a ringed wall up to 20 feet in diameter, 20 feet high, and 1 foot think. The wall is opaque and lasts for the duration.   When the wall appears, each creature within its area must make a Dexterity saving throw. On a failed save, a creature takes 5d8 fire damage, or half as much damage on a successful save.   One side of the wall, selected by you when you cast this spell, deals 5d8 fire damage to each creature that ends its turn within 10 feet of that side or inside the wall. A creature takes the same damage when it enters the wall fo rhte first time on a turn or ends its turn there. The other side of the wall deals no damage.   At Higher Levels. When you cast this spell using a spell slot of 5th level or higher, the damage increases by 1d8 for each slot level above 4th.;Warlock (Fiend)
4;Dominate Beast;4th level Enchantment;1 action;60 feet;V, S;Concentration, up to 1 minute; You attempt to beguile a beast that you can see within range. It must succeed on a W isdom saving throw or be charmed by you for the duration. If you or creatures that are friendly to you are fighting it, it has advantage on the saving throw. While the beast is charmed, you have a telepathic link with it as long as the two of you are on the same plane of existence. You can use this telepathic link to issue commands to the creature while you are conscious (no action required), which it does its best to obey. You can specify a simple and general course of action, such as ??ttack that creature,????un over there,??or ??etch that object.??If the creature completes the order and doesn't receive further direction from you, it defends and preserves itself to the best of its ability. You can use your action to take total and precise control of the target. Until the end of your next turn, the creature takes only the actions you choose, and doesn't do anything that you don't allow it to do. During this time, you can also cause the creature to use a reaction, but this requires you to use your own reaction as well. Each time the target takes damage, it makes a new Wisdom saving throw against the spell. If the saving throw succeeds, the spell ends. At Higher Levels. W hen you cast this spell with a 5th-level spell slot, the duration is concentration, up to 10 minutes. When you use a 6th-level spell slot, the duration is concentration, up to  1 hour. When you use a spell slot of 7th level or higher, the duration is concentration, up to 8 hours.;Warlock (Great Old One)
4;Evard's Black Tentacles;4th level Conjuration;1 action;90 feet;V, S, M ;Concentration, up to 1 minute;(a piece of tentacle from a giant octopus or a giant squid) Squirming, ebony tentacles fill a 20-foot square on ground that you can see within range. For the duration, these tentacles turn the ground in the area into difficult terrain. When a creature enters the afected area for the first time on a turn or starts its turn there, the creature must succeed on a Dexterity saving throw or take 3d6 bludgeoning damage and be restrained by the tentacles until the spell ends. A creature that starts its turn in the area and is already restrained by the tentacles takes 3d6 bludgeoning damage. A creature restrained by the tentacles can use its action to make a Strength or Dexterity check (its choice) against your spell save DC. On a success, it frees itself.;Warlock (Great Old One)
4;Elemental Bane;4th-level transmutation;1 action;90 feet;V, S;Concentration, up to 1 minute; Choose one creature you can see within range, and choose one of the following damage types: acid, cold, fire, lightning, or thunder. The target must succeed on a Constitution saving throw or be affected by the spell for its duration. The first time each turn the affected target takes damage of the chosen type, the target takes an extra 2d6 damage of that type. Moreover, the target loses any resistance to that damage type until the spell ends. At Higher Levels. When you cast this spell using a spell slot of 5th level or higher, you can target one additional creature for each slot level above 4th. The creatures must be within 30 feet of each other when you target them.;Warlock (TOEE)
5;Contact Other Plane (Ritual);5th level Divination;1 minute;Self;V;1 minute; You mentally contact a demigod, the spirit of a long-dead sage, or some other mysterious entity from another plane. Contacting this extraplanar intelligence can strain or even break your mind. When you cast this spell, make a DC 15 Intelligence saving throw. On a failure, you take 6d6 psychic damage and are insane until you finish a long rest. While insane, you can't take actions, can't understand what other creatures say, can't read, and speak only in gibberish. A greater restoration spell cast on you ends this effect. On a successful save, you can ask the entity up to five questions. You must ask your questions before the spell ends. The DM answers each question with one word, such as ⫿yes,? ⫿no,? ⫿maybe,? ⫿never,? ⫿irrelevant,? or ⫿unclear? (if the entity doesn't know the answer to the question). If a one-word answer w ould be misleading, the DM might instead offer a short phrase as an answer.;Warlock
5;Dream;5th level Illusion;1 minute;Special;V, S, M ;8 hours;(a handful of sand, a dab of ink, and a writing quill plucked from a sleeping bird) This spell shapes a creature's dreams. Choose a creature known to you as the target of this spell. The target must be on the same plane of existence as you. Creatures that don't sleep, such as elves, can't be contacted by this spell. You, or a willing creature you touch, enters a trance state, acting as a messenger. While in the trance, the messenger is aware of his or her surroundings, but can't take actions or move. If the target is asleep, the messenger appears in the target's dreams and can converse with the target as long as it remains asleep, through the duration of the spell. The messenger can also shape the environment of the dream, creating landscapes, objects, and other images. The messenger can emerge from the trance at any time, ending the effect of the spell early. The target recalls the dream perfectly upon waking. If the target is awake when you cast the spell, the messenger knows it, and can either end the trance (and the spell) or wait for the target to fall asleep, at which point the messenger appears in the target's dreams. You can make the messenger appear monstrous and terrifying to the target. If you do, the messenger can deliver a message of no more than ten words and then the target must make a Wisdom saving throw. On a failed save, echoes of the phantasmal monstrosity spawn a nightmare that lasts the duration of the target's sleep and prevents the target from gaining any benefit from that rest. In addition, when the target wakes up, it takes 3d6 psychic damage. If you have a body part, lock of hair, clipping from a nail, or similar portion of the target's body, the target makes its saving throw with disadvantage. ;Warlock
5;Hold Monster;5th level Enchantment;1 action;90 feet;V, S, M ;Concentration, up to 1 minute;(a small, straight piece of iron) Choose a creature that you can see within range. The target must succeed on a Wisdom saving throw or be paralyzed for the duration. This spell has no effect on undead. At the end of each of its turns, the target can make another Wisdom saving throw. On a success, the spell ends on the target. At Higher Levels. When you cast this spell using a spell slot of 6th level or higher, you can target on additional creature for each slot level above 5th. The creatures must be within 30 feet of each other when you target them.;Warlock
5;Scrying;5th level Divination;10 minutes;Self;V, S, M ;Concentration, up to 10 minutes;(a focus worth at least 1,000 gp, such as a crystal ball, a silver mirror, or a font filled with holy water) You can see and hear a particular creature you choose that is on the same plane of existence as you. The target must make a W isdom saving throw, which is modified by how well you know the target and the sort of physical connection you have to it. If a target knows you're casting this spell, it can fail the saving throw voluntarily if it wants to be observed. Knowledge -- Save Modifier Secondhand (you have heard of the target) -- +5 Firsthand (you have met the target) +0 Familiar (you know the target well) -- -5 Connection -- Save Modifier Likeness or picture -- -2 Posession or garment -- -4 Body part, lock of hair, bit of nail, or the like -- -10 On a successful save, the target isn't affected, and you can't use this spell against it again for 24 hours.   On a failed save, the spell creates an invisible sensor within 10 feet of the target. You can see and hear through the sensor as if you w ere there. The sensor moves with the target, remaining within 10 feet of it for the duration. A creature that can see invisible objects sees the sensor as a luminous orb about the size of your fist.   Instead of targeting a creature, you can choose a location you have seen before as the target of this spell. When you do, the sensor appears at that location and doesn't move.;Warlock
5;Dominate Person;5th level Enchantment;1 action;60 feet;V, S;Concentration, up to 1 minute; You attempt to beguile a humanoid that you can see within range. It must succeed on a Wisdom saving throw or be charmed by you for the duration. If you or creatures that are friendly to you are fighting it, it has advantage on the saving throw. While the target is charmed, you have a telepathic link with it as long as the two of you are on the same plane of existence. You can use this telepathic link to issue commands to the creature while you are conscious (no action required), which it does its best to obey. You can specify a simple and general course of action, such as ??ttack that creature,????un over there,??or ??etch that object.??If the creature completes the order and doesn't receive further direction from you, it defends and preserves itself to the best of its ability. You can use your action to take total and precise control of the target. Until the end of your next turn, the creature takes only the actions you choose, and doesn't do anything that you don't allow it to do. During this time you can also cause the creature to use a reaction, but this requires you to use your own reaction as well. Each time the target takes damage, it makes a new Wisdom saving throw against the spell. If the saving throw succeeds, the spell ends. At Higher Levels. When you cast this spell using a 6th-level spell slot, the duration is concentration, up to 10 minutes. When you use a 7th-level spell slot, the duration is concentration, up to 1 hour. When you use a spell slot of 8th level or higher, the duration is concentration, up to 8 hours. ;Warlock (Archfey)
5;Seeming;5th level Illusion;1 action;30 feet;V, S;8 hours; This spell allows you to change the appearance of any number of creatures that you cna see within range. You give each target you choose a new, illusory appearance. An unwilling target can make a Charisma saving throw, and if it succeeds, it is unaffected by this spell. The spell disguises physicial appearances as well as clothing, armor, weapons, and equipment. You can make each creature seem 1 foot shorter or taller and appear thin, fat, or inbetween. You can't change a target's body type, so you must choose a form that has the same basic arrangement of limbs. Otherwise, the extent of the illusion is up to you. The spell lasts for the duration, unless you use your action to dismiss it sooner. The changes wrought by this spell fail to hold up to physical inspections. For example, if you use this spell to add a hat to a creature's outfitm objects pass through the hat, and anyone who touches it would feel nothing or would feel the creature's head and hair. If you use this spell to appear thinner then you are, the hand of someone who reaches out to touch you would bump into you while it was seemingly still in midair. A creature can use its action to inspect a target and make an Intelligence (Investigation) check against your spell save DC. If it succeeds, it becomes aware that the target is disguised.;Warlock (Archfey)
5;Flame Strike;5th level Evocation;1 action;60 feet;V, S, M ;Instantaneous;(pinch of sulfur) A vertical column of divine fire roars down from the heavens in a location you specify. Each creature in a 10-foot radius, 40-foot-high cylinder centered on a point within range must make a Dexterity saving throw. A creature takes 4d6 fire damage and 4d6 radiant damage on a failed save, or half as much damage on a successful one. At Higher Levels. When you cast this spell using a spell slot of 6th level or higher, the fire damage or the radiant damage (your choice) inceases by 1d6 for each slot level above 5th.;Warlock (Fiend)
5;Hallow;5th level Evocation;24 hours;Touch;V, S, M ;Until dispelled;(herbs, oils, and incense worth at least 1,000 gp, which the spell consumes) You touch a point and infuse an area around it with holy (or unholy) power. The area can have a radius up to 60 feet, and the spell fails if the radius includes an area already under the effect a hallow spell. The affected area is subject to the following effects. First, celestials, elementals, fey, fiends, and undead can't enter the area, nor can such creatures charm, frighten, or possess creatures within it. Any creature charmed, frightened, or possessed by such a creature is no longer charmed, frightened, or possessed upon entering the area. You can exclude one or more of those types of creatures from this effect. Second, you can bind an extra effect to the area. Choose the effect from the following list, or choose an effect offered by the DM. Som e of these effects apply to creatures in the area,  you can designate whether the effect applies to all creatures, creatures that follow a specific deity or leader, or creatures of a specific sort, such as ores or trolls. When a creature that would be affected enters the spell's area for the first time on a turn or starts its turn there, it can make a Charisma saving throw. On a success, the creature ignores the extra effect until it leaves the area. Courage. Affected creatures can't be frightened while in the area. Darkness. Darkness fills the area. Normal light, as well as magical light created by spells of a lower level than the slot you used to cast this spell, can't illuminate the area. Daylight. Bright light fills the area. Magical darkness created by spells of a lower level than the slot you used to cast this spell can't extinguish the light. Energy Protection. Affected creatures in the area have resistance to one damage type of your choice, except for bludgeoning, piercing, or slashing. Energy Vulnerability. Affected creatures in the area have vulnerability to one damage type of your choice, except for bludgeoning, piercing, or slashing. Everlasting Rest. Dead bodies interred in the area can't be turned into undead. Extradimensional Interference. Affected creatures can't move or travel using teleportation or by extradimensional or interplanar means. Fear. Affected creatures are frightened while in the area. Silence. No sound can emanate from within the area, and no sound can reach into it. Tongues. Affected creatures can communicate with any other creature in the area, even if they don't share a common language.;Warlock (Fiend)
5;Dominate Person;5th level Enchantment;1 action;60 feet;V, S;Concentration, up to 1 minute; You attempt to beguile a humanoid that you can see within range. It must succeed on a Wisdom saving throw or be charmed by you for the duration. If you or creatures that are friendly to you are fighting it, it has advantage on the saving throw. While the target is charmed, you have a telepathic link with it as long as the two of you are on the same plane of existence. You can use this telepathic link to issue commands to the creature while you are conscious (no action required), which it does its best to obey. You can specify a simple and general course of action, such as ⫿Attack that creature,? ⫿Run over there,? or ⫿Fetch that object.? If the creature completes the order and doesn't receive further direction from you, it defends and preserves itself to the best of its ability. You can use your action to take total and precise control of the target. Until the end of your next turn, the creature takes only the actions you choose, and doesn't do anything that you don't allow it to do. During this time you can also cause the creature to use a reaction, but this requires you to use your own reaction as well. Each time the target takes damage, it makes a new Wisdom saving throw against the spell. If the saving throw succeeds, the spell ends. At Higher Levels. When you cast this spell using a 6th-level spell slot, the duration is concentration, up to 10 minutes. When you use a 7th-level spell slot, the duration is concentration, up to 1 hour. When you use a spell slot of 8th level or higher, the duration is concentration, up to 8 hours. ;Warlock (Great Old One)
5;Telekinesis;5th level Transmutation;1 action;60 feet;V, S;Concentration, up to 10 minutes; You gain the ability to move or manipulate creatures or objects by thought. When you cast the spell, and as your action each round for the duration, you can exert your will on one creature or object that you can see within range, causing the appropriate effect below. You can affect the same target round after round, or choose a new one at any time. If you switch targets, the prior target is no longer affected by the spell. Creature. You can try to move a Huge or smaller creature. Make an ability check with your spellcasting ability contested by the creature's Strength check. If you win the contest, you move the creature up to 30 feet in any direction, including upward but not beyond the range of this spell. Until the end of your next turn, the creature is restrained in your telekinetic grip. A creature lifted upward is suspended in mid-air. On subsequent rounds, you can use your action to attempt to maintain your telekinetic grip on the creature by repeating the contest.   Object. You can try to move an object that weighs up to 1,000 pounds. If the object isn't being worn or carried, you automatically move it up to 30 feet in any direction, but not beyond the range of this spell. If the object is worn or carried by a creature, you must make an ability check with your spellcasting ability contested by that creature's Strength check. If you succeed, you pull the object away from that creature and can move it up to 30 feet in any direction but not beyond the range of this spell. You can exert fine control on objects with your telekinetic grip, such as manipulating a simple tool, opening a door or a container, stowing or retrieving an item from an open container, or pouring the contents from a vial.;Warlock (Great Old One)
